<?xml version="1.0" encoding="UTF-8"?><season_data xmlns:xsi="http://www.w3.org/2001/XMLSchema-instance" xsi:noNamespaceSchemaLocation="./data/season_data.xsd"><season><name>Super League 2008</name><competition><name>Super League</name><gender>men</gender></competition><date><start>2008-02-01</start><end>2008-10-06</end><year>2008</year></date></season><stages><stage start_date="2008-02-01" end_date="2008-09-09" phase="stage_1"><groups><group><competitor id="sr:competitor:4275"><name>Warrington Wolves</name><abbreviation>WAR</abbreviation></competitor><competitor id="sr:competitor:4234"><name>St Helens</name><abbreviation>STH</abbreviation></competitor><competitor id="sr:competitor:4273"><name>Wakefield Trinity</name><abbreviation>WAK</abbreviation></competitor><competitor id="sr:competitor:4268"><name>Leeds Rhinos</name><abbreviation>LEE</abbreviation></competitor><competitor id="sr:competitor:4233"><name>Wigan Warriors</name><abbreviation>WGW</abbreviation></competitor><competitor id="sr:competitor:4269"><name>London Broncos</name><abbreviation>LON</abbreviation></competitor><competitor id="sr:competitor:4274"><name>Castleford Tigers</name><abbreviation>CAS</abbreviation></competitor><competitor id="sr:competitor:4272"><name>Bradford Bulls</name><abbreviation>BRA</abbreviation></competitor><competitor id="sr:competitor:4271"><name>Hull FC</name><abbreviation>HFC</abbreviation></competitor><competitor id="sr:competitor:4246"><name>Hull Kingston Rovers</name><abbreviation>HKR</abbreviation></competitor><competitor id="sr:competitor:4241"><name>Huddersfield Giants</name><abbreviation>HFG</abbreviation></competitor><competitor id="sr:competitor:7945"><name>Catalans Dragons</name><abbreviation>CAT</abbreviation></competitor></group></groups></stage></stages><competitors><competitor id="sr:competitor:4275"><name>Warrington Wolves</name><players/></competitor><competitor id="sr:competitor:4234"><name>St Helens</name><players/></competitor><competitor id="sr:competitor:4273"><name>Wakefield Trinity</name><players/></competitor><competitor id="sr:competitor:4268"><name>Leeds Rhinos</name><players/></competitor><competitor id="sr:competitor:4233"><name>Wigan Warriors</name><players/></competitor><competitor id="sr:competitor:4269"><name>London Broncos</name><players/></competitor><competitor id="sr:competitor:4274"><name>Castleford Tigers</name><players/></competitor><competitor id="sr:competitor:4272"><name>Bradford Bulls</name><players/></competitor><competitor id="sr:competitor:4271"><name>Hull FC</name><players/></competitor><competitor id="sr:competitor:4246"><name>Hull Kingston Rovers</name><players/></competitor><competitor id="sr:competitor:4241"><name>Huddersfield Giants</name><players/></competitor><competitor id="sr:competitor:7945"><name>Catalans Dragons</name><players/></competitor></competitors></season_data>